{
  "schemaVersion": 1,
  "contentVersion": "1.0.0",
  "licenseNote": "Original MindForge educational content; no third-party questions or assets.",
  "topics": [
    {
      "id": "count-to-10",
      "name": {
        "en": "Count to 10",
        "vi": "Đếm đến 10"
      },
      "ageGuidance": "5-7 (informal)",
      "prerequisites": [],
      "objectives": [
        {
          "en": "Match a set of objects to a numeral from 0 to 10.",
          "vi": "Ghép nhóm đồ vật với số từ 0 đến 10."
        },
        {
          "en": "Count each object once.",
          "vi": "Đếm mỗi đồ vật đúng một lần."
        },
        {
          "en": "Explain the total after counting.",
          "vi": "Nói tổng số sau khi đếm."
        }
      ],
      "lessons": [
        {
          "id": "count-to-10-lesson-1",
          "topicId": "count-to-10",
          "title": {
            "en": "Step 1: Count to 10",
            "vi": "Bước 1: Đếm đến 10"
          },
          "steps": [
            {
              "id": "observe",
              "mode": "explain",
              "prompt": {
                "en": "Watch this example and count with me.",
                "vi": "Con hãy xem ví dụ và đếm cùng nhé."
              },
              "manipulative": {
                "kind": "ten-frame",
                "counts": [
                  1
                ],
                "target": 10
              }
            },
            {
              "id": "try",
              "mode": "try",
              "prompt": {
                "en": "How many counters can you see?",
                "vi": "Con nhìn thấy bao nhiêu chấm tròn?"
              },
              "manipulative": {
                "kind": "ten-frame",
                "counts": [
                  1
                ],
                "target": 10
              },
              "answerSpec": {
                "kind": "number",
                "value": 1
              },
              "hintSteps": [
                {
                  "en": "Point to each counter once, from left to right.",
                  "vi": "Chỉ vào từng chấm tròn một lần, từ trái sang phải."
                },
                {
                  "en": "Say the last number you counted.",
                  "vi": "Nói số cuối cùng con vừa đếm."
                }
              ],
              "explanation": {
                "en": "There are 1 counters, so the answer is 1.",
                "vi": "Có 1 chấm tròn nên đáp án là 1."
              }
            },
            {
              "id": "reflect",
              "mode": "reflect",
              "prompt": {
                "en": "Tell someone how you found the answer.",
                "vi": "Kể cho người bên cạnh con đã tìm ra đáp án như thế nào."
              }
            }
          ]
        },
        {
          "id": "count-to-10-lesson-2",
          "topicId": "count-to-10",
          "title": {
            "en": "Step 2: Count to 10",
            "vi": "Bước 2: Đếm đến 10"
          },
          "steps": [
            {
              "id": "observe",
              "mode": "explain",
              "prompt": {
                "en": "Let's try another example together.",
                "vi": "Mình cùng thử thêm một ví dụ nhé."
              },
              "manipulative": {
                "kind": "ten-frame",
                "counts": [
                  2
                ],
                "target": 10
              }
            },
            {
              "id": "try",
              "mode": "try",
              "prompt": {
                "en": "How many counters can you see?",
                "vi": "Con nhìn thấy bao nhiêu chấm tròn?"
              },
              "manipulative": {
                "kind": "ten-frame",
                "counts": [
                  2
                ],
                "target": 10
              },
              "answerSpec": {
                "kind": "number",
                "value": 2
              },
              "hintSteps": [
                {
                  "en": "Point to each counter once, from left to right.",
                  "vi": "Chỉ vào từng chấm tròn một lần, từ trái sang phải."
                },
                {
                  "en": "Say the last number you counted.",
                  "vi": "Nói số cuối cùng con vừa đếm."
                }
              ],
              "explanation": {
                "en": "There are 2 counters, so the answer is 2.",
                "vi": "Có 2 chấm tròn nên đáp án là 2."
              }
            },
            {
              "id": "reflect",
              "mode": "reflect",
              "prompt": {
                "en": "Tell someone how you found the answer.",
                "vi": "Kể cho người bên cạnh con đã tìm ra đáp án như thế nào."
              }
            }
          ]
        },
        {
          "id": "count-to-10-lesson-3",
          "topicId": "count-to-10",
          "title": {
            "en": "Step 3: Count to 10",
            "vi": "Bước 3: Đếm đến 10"
          },
          "steps": [
            {
              "id": "observe",
              "mode": "explain",
              "prompt": {
                "en": "Find the answer by yourself.",
                "vi": "Con thử tự tìm đáp án nhé."
              },
              "manipulative": {
                "kind": "ten-frame",
                "counts": [
                  4
                ],
                "target": 10
              }
            },
            {
              "id": "try",
              "mode": "try",
              "prompt": {
                "en": "How many counters can you see?",
                "vi": "Con nhìn thấy bao nhiêu chấm tròn?"
              },
              "manipulative": {
                "kind": "ten-frame",
                "counts": [
                  4
                ],
                "target": 10
              },
              "answerSpec": {
                "kind": "number",
                "value": 4
              },
              "hintSteps": [
                {
                  "en": "Point to each counter once, from left to right.",
                  "vi": "Chỉ vào từng chấm tròn một lần, từ trái sang phải."
                },
                {
                  "en": "Say the last number you counted.",
                  "vi": "Nói số cuối cùng con vừa đếm."
                }
              ],
              "explanation": {
                "en": "There are 4 counters, so the answer is 4.",
                "vi": "Có 4 chấm tròn nên đáp án là 4."
              }
            },
            {
              "id": "reflect",
              "mode": "reflect",
              "prompt": {
                "en": "Tell someone how you found the answer.",
                "vi": "Kể cho người bên cạnh con đã tìm ra đáp án như thế nào."
              }
            }
          ]
        }
      ],
      "examples": [
        {
          "id": "count-to-10-practice-1",
          "topicId": "count-to-10",
          "schemaVersion": 1,
          "seed": 1001,
          "difficulty": "starter",
          "prompt": {
            "en": "How many counters can you see?",
            "vi": "Con nhìn thấy bao nhiêu chấm tròn?"
          },
          "manipulative": {
            "kind": "ten-frame",
            "counts": [
              1
            ],
            "target": 10
          },
          "answerSpec": {
            "kind": "number",
            "value": 1
          },
          "hintSteps": [
            {
              "en": "Point to each counter once, from left to right.",
              "vi": "Chỉ vào từng chấm tròn một lần, từ trái sang phải."
            },
            {
              "en": "Say the last number you counted.",
              "vi": "Nói số cuối cùng con vừa đếm."
            }
          ],
          "explanation": {
            "en": "There are 1 counters, so the answer is 1.",
            "vi": "Có 1 chấm tròn nên đáp án là 1."
          }
        },
        {
          "id": "count-to-10-practice-2",
          "topicId": "count-to-10",
          "schemaVersion": 1,
          "seed": 1002,
          "difficulty": "normal",
          "prompt": {
            "en": "How many counters can you see?",
            "vi": "Con nhìn thấy bao nhiêu chấm tròn?"
          },
          "manipulative": {
            "kind": "ten-frame",
            "counts": [
              2
            ],
            "target": 10
          },
          "answerSpec": {
            "kind": "number",
            "value": 2
          },
          "hintSteps": [
            {
              "en": "Point to each counter once, from left to right.",
              "vi": "Chỉ vào từng chấm tròn một lần, từ trái sang phải."
            },
            {
              "en": "Say the last number you counted.",
              "vi": "Nói số cuối cùng con vừa đếm."
            }
          ],
          "explanation": {
            "en": "There are 2 counters, so the answer is 2.",
            "vi": "Có 2 chấm tròn nên đáp án là 2."
          }
        },
        {
          "id": "count-to-10-practice-3",
          "topicId": "count-to-10",
          "schemaVersion": 1,
          "seed": 1003,
          "difficulty": "normal",
          "prompt": {
            "en": "How many counters can you see?",
            "vi": "Con nhìn thấy bao nhiêu chấm tròn?"
          },
          "manipulative": {
            "kind": "ten-frame",
            "counts": [
              4
            ],
            "target": 10
          },
          "answerSpec": {
            "kind": "number",
            "value": 4
          },
          "hintSteps": [
            {
              "en": "Point to each counter once, from left to right.",
              "vi": "Chỉ vào từng chấm tròn một lần, từ trái sang phải."
            },
            {
              "en": "Say the last number you counted.",
              "vi": "Nói số cuối cùng con vừa đếm."
            }
          ],